{
  "format": "bridge-record",
  "schemaVersion": "1.1",
  "profile": "standalone",
  "recordType": "table-board",
  "recordId": "urn:uuid:3f2c9a10-4b7e-4c1a-9d2f-6e8a1b2c3d4e",
  "createdAt": "2026-10-27T00:00:00Z",
  "producer": {
    "application": "bridge-mvp",
    "version": "0.1.0"
  },
  "deal": {
    "dealId": "deal-2026-0001",
    "boardNumber": 1,
    "dealer": "N",
    "vulnerability": "NONE",
    "pbn": "N:AKQ2.JT9.543.876 JT98.AKQ.AKQJ.T9 76543.8765.T98.A -.432.762.KQJ5432"
  },
  "status": "PASSED_OUT",
  "auction": {
    "calls": [
      "PASS",
      "PASS",
      "PASS",
      "PASS"
    ],
    "completed": true
  },
  "score": {
    "nsRaw": 0,
    "source": "computed"
  },
  "hcp": {
    "ns": 14,
    "ew": 26
  },
  "derived": {
    "imp": {
      "singleTable": 0,
      "tableVersion": "wbf-2017"
    }
  },
  "engine": {
    "dealSource": {
      "kind": "seeded",
      "baseSeed": 2026,
      "index": 0
    },
    "rngSeed": 2931564761,
    "streams": {
      "deal": 2931564761,
      "bidding": 3056024501,
      "play": 4016366938,
      "dds": 3100401203
    },
    "ruleset": {
      "system": "precision",
      "systemVersion": "0.5.0",
      "rulesetId": "sha256:39e571721cec89a8d3c8c1e7d469953f369961d5aaf4ed6c557a0e76aa8b7cd7",
      "overlay": false
    },
    "playRulesets": {
      "lead": {
        "name": "leads",
        "rulesetId": "sha256:ffdd287bcf81234ba06909193f18955c5db70112c32146ea88ba63b891ef51c0",
        "overlay": false
      },
      "signal": {
        "name": "signals",
        "rulesetId": "sha256:f01ec503ddcc3e01cf019071c6611d2238b143a3bebc481f7c1799dcccddc911",
        "overlay": false,
        "settings": {
          "signal_spot_max_rank": 10,
          "encourage_discard_min_rank": 8
        }
      }
    },
    "seats": {
      "N": {
        "controller": "ai",
        "bidStyle": 1,
        "playStyle": 1,
        "randomness": 0,
        "ddsPlay": false,
        "ddsSamples": 1,
        "objective": "contract"
      },
      "E": {
        "controller": "ai",
        "bidStyle": 1,
        "playStyle": 1,
        "randomness": 0,
        "ddsPlay": false,
        "ddsSamples": 1,
        "objective": "contract"
      },
      "S": {
        "controller": "human",
        "bidStyle": 1,
        "playStyle": 1,
        "randomness": 0,
        "ddsPlay": false,
        "ddsSamples": 1,
        "objective": "contract"
      },
      "W": {
        "controller": "ai",
        "bidStyle": 1,
        "playStyle": 1,
        "randomness": 0,
        "ddsPlay": false,
        "ddsSamples": 1,
        "objective": "contract"
      }
    },
    "inference": {
      "auctionConstraints": true,
      "leadInference": true
    },
    "engineVersion": "0.1.0",
    "snapshotAt": "2026-10-27T00:00:00Z",
    "rngMode": "streams",
    "rulesVersion": "wbf-laws-2017"
  }
}
